{
  "schema_version": "0.1.0",
  "tool": { "name": "tivor-open-probe", "version": "0.1.0", "platform_adapter": "macos-v0.1" },
  "run": { "run_id": "fixture-complete", "started_at": "2026-09-26T00:00:00Z", "finished_at": "2026-09-26T00:00:01Z", "status": "complete" },
  "environment": { "os": "macos", "architecture": "arm64", "ipv4_available": true, "ipv6_available": true },
  "registry_versions": { "measurements": "0.1.0", "providers": "0.1.0" },
  "checks": [{
    "check_id": "fixture.interface", "check_version": "0.1.0", "capability": "interface.snapshot", "status": "complete",
    "started_at": "2026-09-26T00:00:00Z", "finished_at": "2026-09-26T00:00:01Z", "duration_ms": 1,
    "evidence": [{ "evidence_id": "e1", "observed_at": "2026-09-26T00:00:01Z", "provenance": "observed", "state": "healthy", "confidence": "high", "privacy_classification": "private_local", "value_type": "interface_state", "value": { "interface_category": "wifi", "state": "up" }, "address_family": "not_applicable", "limitations": [], "supports": [] }],
    "errors": []
  }],
  "provider_paths": [], "limitations": [],
  "permissions": [{ "capability": "read_interfaces", "mode": "required", "result": "available" }],
  "redaction": { "state": "private_local", "policy_id": "none", "validation": "not_applicable", "removed_paths": [], "transformed_paths": [] }
}
