{
  "schema_version": "0.1.0",
  "tool": { "name": "tivor-open-probe", "version": "0.1.0", "platform_adapter": "macos-v0.1" },
  "run": { "run_id": "fixture-partial", "started_at": "2026-09-26T00:00:00Z", "finished_at": "2026-09-26T00:00:01Z", "status": "partial" },
  "environment": { "os": "macos", "architecture": "arm64", "ipv4_available": null, "ipv6_available": null },
  "registry_versions": { "measurements": "0.1.0", "providers": "0.1.0" },
  "checks": [{ "check_id": "fixture.route", "check_version": "0.1.0", "capability": "route.lookup", "status": "unsupported", "started_at": "2026-09-26T00:00:00Z", "finished_at": "2026-09-26T00:00:01Z", "duration_ms": 0, "evidence": [], "errors": [{ "code": "route.unsupported", "phase": "platform", "retryable": false, "summary": "Route observation is unsupported in this adapter." }] }],
  "provider_paths": [{ "provider_id": "openai", "adapter_version": "0.1.0", "local_path_state": "incomplete", "confidence": "unknown", "supporting_evidence_ids": [], "provider_reported_state": null, "limitations": ["No network measurement was performed"] }],
  "limitations": ["Slice 1 performs no network measurements"],
  "permissions": [{ "capability": "read_routes", "mode": "optional", "result": "unsupported" }],
  "redaction": { "state": "private_local", "policy_id": "none", "validation": "not_applicable", "removed_paths": [], "transformed_paths": [] }
}
